<?xml version="1.0"?>
<!DOCTYPE database SYSTEM "http://db.apache.org/torque/dtd/database.dtd">

<database name="multitier">

    <table name="sync_home_to_workstation">
        <column name="id" type="INTEGER" required="true"
            autoIncrement="true" primaryKey="true" />
        <column name="string_one_value" type="VARCHAR" size="50" />
        <column name="long_string_value" type="LONGVARCHAR" />
        <column name="time_value" type="TIMESTAMP" />
        <column name="date_value" type="DATE" />
        <column name="boolean_value" type="BIT" size="1" />
        <column name="bigInt_value" type="BIGINT" />
        <column name="decimal_value" type="DECIMAL" />
    </table>

    <table name="sync_workstation_to_home">
        <column name="id" type="VARCHAR" size="50" required="true"
            primaryKey="true" />
        <column name="textColumn" type="VARCHAR" size="50" />
    </table>


</database>