<?xml version="1.0"?>
<!DOCTYPE database SYSTEM "http://db.apache.org/torque/dtd/database.dtd">

<database name="sample">

    <table name="item_selling_price">
        <column name="price_id" type="INTEGER" required="true" primaryKey="true" />
        <column name="price" type="DECIMAL" size="10,2" required="true" />
        <column name="cost" type="DECIMAL" size="10,2" required="false" />
    </table>

    <table name="item">
        <column name="item_id" type="INTEGER" required="true" primaryKey="true" />
        <column name="price_id" type="INTEGER" required="true" />
        <column name="name" type="VARCHAR" size="100" />
        <foreign-key name="fk_item_price_id" foreignTable="item_selling_price">
            <reference local="price_id" foreign="price_id" />
        </foreign-key>
    </table>

    <table name="sale_transaction">
        <column name="tran_id" type="INTEGER" required="true" primaryKey="true" />
        <column name="store" type="VARCHAR" size="5" required="true" />
        <column name="workstation" type="VARCHAR" size="3" required="true" />
        <column name="day" type="VARCHAR" size="10" required="true" />
        <column name="seq" type="INTEGER" required="true" />
    </table>

    <table name="sale_return_line_item">
        <column name="tran_id" type="INTEGER" required="true" primaryKey="true" />
        <column name="item_id" type="INTEGER" required="true" />
        <column name="price" type="DECIMAL" size="10,2" required="true" />
        <column name="quantity" type="INTEGER" required="true" />
        <column name="returned_quantity" type="INTEGER"/>
        <foreign-key name="fk_srli_tran_id" foreignTable="sale_transaction">
            <reference local="tran_id" foreign="tran_id" />
        </foreign-key>
        <foreign-key name="fk_srli_item_id" foreignTable="item">
            <reference local="item_id" foreign="item_id" />
        </foreign-key>
    </table>

</database>